[
  {
    "id": "hope-01",
    "greetings": [
      "Good morning.",
      "Hello, friend."
    ],
    "body": "Your current chapter is not your final story. Hope is still reasonable, even on a slow morning like this.",
    "action": "Write down one thing you still believe is possible.",
    "category": "hope",
    "moods": [
      "low",
      "struggling",
      "okay"
    ],
    "situations": [
      "life-changes",
      "purpose",
      "failure"
    ],
    "styles": [
      "gentle",
      "reflective",
      "friendly"
    ],
    "faith": false
  },
  {
    "id": "hope-02",
    "greetings": [
      "Take a breath.",
      "Hey, keep going."
    ],
    "body": "You have survived every hard day so far. That track record matters. Today can still hold something good.",
    "action": "Name one small light in today and sit with it for a minute.",
    "category": "hope",
    "moods": [
      "low",
      "struggling"
    ],
    "situations": [
      "life-changes",
      "growth",
      "purpose"
    ],
    "styles": [
      "gentle",
      "motivational"
    ],
    "faith": false
  },
  {
    "id": "hope-03",
    "greetings": [
      "Good morning.",
      "A fresh start."
    ],
    "body": "Small beginnings count. Plant one hopeful step today and let tomorrow build on it.",
    "action": "Send a hopeful message to someone you trust.",
    "category": "hope",
    "moods": [
      "okay",
      "good",
      "low"
    ],
    "situations": [
      "purpose",
      "growth",
      "relationships"
    ],
    "styles": [
      "practical",
      "friendly",
      "motivational"
    ],
    "faith": false
  },
  {
    "id": "hope-04",
    "greetings": [
      "Listen.",
      "You are seen."
    ],
    "body": "Feeling low does not mean you are failing. It means you are human and still in the fight.",
    "action": "Write down one thing you still believe is possible.",
    "category": "hope",
    "moods": [
      "low",
      "struggling"
    ],
    "situations": [
      "confidence",
      "purpose",
      "failure"
    ],
    "styles": [
      "gentle",
      "reflective"
    ],
    "faith": false
  },
  {
    "id": "hope-05",
    "greetings": [
      "Keep looking up.",
      "Morning light."
    ],
    "body": "Progress is often invisible before it is obvious. Stay with the process one more day.",
    "action": "Name one small light in today and sit with it for a minute.",
    "category": "hope",
    "moods": [
      "okay",
      "low",
      "good"
    ],
    "situations": [
      "career",
      "business",
      "growth"
    ],
    "styles": [
      "motivational",
      "practical"
    ],
    "faith": false
  },
  {
    "id": "hope-06",
    "greetings": [
      "Bold truth:",
      "Hear this."
    ],
    "body": "You are allowed to start again today. Yesterday's weight does not get the final vote.",
    "action": "Send a hopeful message to someone you trust.",
    "category": "hope",
    "moods": [
      "struggling",
      "low",
      "okay"
    ],
    "situations": [
      "failure",
      "life-changes",
      "purpose"
    ],
    "styles": [
      "bold",
      "direct",
      "motivational"
    ],
    "faith": false
  },
  {
    "id": "conf-01",
    "greetings": [
      "Good morning.",
      "Stand tall."
    ],
    "body": "You do not need permission to believe in yourself. Your skills are real and they travel with you.",
    "action": "Write down three things you are good at.",
    "category": "confidence",
    "moods": [
      "low",
      "okay",
      "struggling"
    ],
    "situations": [
      "confidence",
      "career",
      "school"
    ],
    "styles": [
      "bold",
      "motivational",
      "direct"
    ],
    "faith": false
  },
  {
    "id": "conf-02",
    "greetings": [
      "Gentle reminder.",
      "Hey."
    ],
    "body": "Confidence grows by evidence, not hype. Look at one thing you handled well this week.",
    "action": "Stand tall, breathe deeply, and say one true strength out loud.",
    "category": "confidence",
    "moods": [
      "okay",
      "low",
      "good"
    ],
    "situations": [
      "confidence",
      "purpose",
      "growth"
    ],
    "styles": [
      "gentle",
      "reflective",
      "friendly"
    ],
    "faith": false
  },
  {
    "id": "conf-03",
    "greetings": [
      "Before you walk in.",
      "You belong there."
    ],
    "body": "You were invited, chosen, or earned your place. Walk in like the room needs what you carry.",
    "action": "Do one small thing you have been avoiding to prove you can.",
    "category": "confidence",
    "moods": [
      "okay",
      "good",
      "low"
    ],
    "situations": [
      "career",
      "school",
      "business"
    ],
    "styles": [
      "bold",
      "motivational",
      "direct"
    ],
    "faith": false
  },
  {
    "id": "conf-04",
    "greetings": [
      "Quiet truth.",
      "Listen."
    ],
    "body": "Nervous does not mean unready. It means you care. Let care sharpen you, not stop you.",
    "action": "Write down three things you are good at.",
    "category": "confidence",
    "moods": [
      "low",
      "struggling",
      "okay"
    ],
    "situations": [
      "confidence",
      "school",
      "career"
    ],
    "styles": [
      "gentle",
      "reflective"
    ],
    "faith": false
  },
  {
    "id": "conf-05",
    "greetings": [
      "Practical step.",
      "Today:"
    ],
    "body": "Pick one skill you want to trust more, then practice it for ten focused minutes today.",
    "action": "Do one small thing you have been avoiding to prove you can.",
    "category": "confidence",
    "moods": [
      "okay",
      "good"
    ],
    "situations": [
      "growth",
      "career",
      "confidence"
    ],
    "styles": [
      "practical",
      "direct",
      "motivational"
    ],
    "faith": false
  },
  {
    "id": "conf-06",
    "greetings": [
      "Hey, friend.",
      "Remember."
    ],
    "body": "People already trust you more than you trust yourself. Borrow their view until yours catches up.",
    "action": "Stand tall, breathe deeply, and say one true strength out loud.",
    "category": "confidence",
    "moods": [
      "low",
      "okay",
      "good"
    ],
    "situations": [
      "relationships",
      "confidence",
      "purpose"
    ],
    "styles": [
      "friendly",
      "gentle",
      "motivational"
    ],
    "faith": false
  },
  {
    "id": "mot-01",
    "greetings": [
      "Let's move.",
      "Morning fuel."
    ],
    "body": "You do not need to feel like it to start. Start small and let motion create motivation.",
    "action": "Spend 15 minutes on the task you keep postponing.",
    "category": "motivation",
    "moods": [
      "okay",
      "low",
      "good"
    ],
    "situations": [
      "growth",
      "career",
      "school"
    ],
    "styles": [
      "bold",
      "practical",
      "motivational"
    ],
    "faith": false
  },
  {
    "id": "mot-02",
    "greetings": [
      "Midday reset.",
      "Breathe."
    ],
    "body": "You are still moving forward even if today feels slow. One focused block can change the day.",
    "action": "Break today's goal into one 10-minute step and start it.",
    "category": "motivation",
    "moods": [
      "okay",
      "low",
      "good"
    ],
    "situations": [
      "business",
      "career",
      "school"
    ],
    "styles": [
      "practical",
      "friendly",
      "motivational"
    ],
    "faith": false
  },
  {
    "id": "mot-03",
    "greetings": [
      "Gentle push.",
      "Hey."
    ],
    "body": "Big goals are built from boring reps. Do today's rep well and trust the compound effect.",
    "action": "Spend 15 minutes on the task you keep postponing.",
    "category": "motivation",
    "moods": [
      "good",
      "okay",
      "great"
    ],
    "situations": [
      "growth",
      "growth",
      "purpose"
    ],
    "styles": [
      "practical",
      "reflective"
    ],
    "faith": false
  },
  {
    "id": "mot-04",
    "greetings": [
      "When tired.",
      "Rest, then rise."
    ],
    "body": "Tired is information, not identity. Rest briefly, then take one clear next step.",
    "action": "Clear one small space to clear your mind.",
    "category": "motivation",
    "moods": [
      "low",
      "struggling",
      "okay"
    ],
    "situations": [
      "growth",
      "life-changes",
      "confidence"
    ],
    "styles": [
      "gentle",
      "practical"
    ],
    "faith": false
  },
  {
    "id": "mot-05",
    "greetings": [
      "Direct word:",
      "No more waiting."
    ],
    "body": "Waiting for perfect conditions wastes good days. Use what you have, where you are, today.",
    "action": "Break today's goal into one 10-minute step and start it.",
    "category": "motivation",
    "moods": [
      "okay",
      "good",
      "low"
    ],
    "situations": [
      "business",
      "career",
      "purpose"
    ],
    "styles": [
      "bold",
      "direct"
    ],
    "faith": false
  },
  {
    "id": "mot-06",
    "greetings": [
      "Evening check.",
      "Well done."
    ],
    "body": "You showed up when quitting would have been easier. That counts more than you think.",
    "action": "Clear one small space to clear your mind.",
    "category": "motivation",
    "moods": [
      "good",
      "great",
      "okay"
    ],
    "situations": [
      "growth",
      "purpose"
    ],
    "styles": [
      "friendly",
      "reflective",
      "motivational"
    ],
    "faith": false
  },
  {
    "id": "str-01",
    "greetings": [
      "When heavy.",
      "You are held."
    ],
    "body": "You can do hard things and still need rest. Strength includes asking for support.",
    "action": "Ask one person for help instead of carrying it alone.",
    "category": "strength",
    "moods": [
      "low",
      "struggling"
    ],
    "situations": [
      "life-changes",
      "family",
      "failure"
    ],
    "styles": [